,question,example_answer,pred_answer,exact_matching,lm_evaluation
0,what team does messi play for 2011?,"['Argentina national football team', 'FC Barcelona']",Barcelona,False,True
1,who did armie hammer play in the social network?,"['Tyler Winklevoss', 'Cameron Winklevoss']",Armie Hammer,False,False
2,what team did jackie robinson?,"['Kansas City Monarchs', 'Montreal Royals', 'Los Angeles Bulldogs', 'Brooklyn Dodgers', 'UCLA Bruins football']",42,False,False
3,what area of science did sir isaac newton study?,"['Chemist', 'Philosopher', 'Mathematician', 'Physicist', 'Scientist', 'Astronomer']",Physics,False,False
4,where is taylor swift from?,['Reading'],"Reading, Pennsylvania",False,False
5,where did paula deen go to school?,['Albany High School'],unknown,False,False
6,what drug killed marilyn monroe?,['Barbiturate overdose'],Nembutal,False,True
7,who is martin luther king jr facts?,"['Civil rights activist', 'Pastor', 'Minister', 'Humanitarian', 'Writer', 'Clergy']",Civil rights activist and leader.,False,True
8,where is daud ibrahim?,['Maharashtra'],unknown,False,False
9,where did richard nixon die?,['New York City'],San Clemente,False,False
10,where does robert irvine come from?,['Salisbury'],Scotland,False,False
11,what position does brandon roy play?,"['Point guard', 'Shooting guard', 'Small forward']",Shooting guard.,True,True
12,where was bin laden found and killed?,['Abbottabad'],Abbottabad,True,True
13,where did jrr tolkien go to school?,"[""King Edward's School, Birmingham"", 'University of Oxford', ""St. Philip's School"", 'Exeter College, Oxford']","Oxford, Exeter College",False,True
14,what did stephen hawking study?,['Physics'],Physics and cosmology.,False,False
15,what timezone is tucson arizona in right now?,['Mountain Time Zone'],Pacific Time Zone,False,False
16,who was the artist of mickey mouse?,"['Walt Disney', 'Ub Iwerks']",Walt Disney,True,True
17,what time is it in texas houston right now?,['Central Time Zone'],UTC,False,False
18,who is jacob latimore?,"['Dancer', 'Actor', 'Singer']","Jacob Latimore is a singer, actor, and dancer.",False,True
19,what county is utica ny in?,['Oneida County'],Oneida,False,False
20,where did martin luther king got shot at?,['Memphis'],Lorraine Motel,False,False
21,what school did karl benz go to?,['Karlsruhe Institute of Technology'],Karlsruhe Polytechnic,False,False
22,what type of music did antonio vivaldi play?,"['Baroque music', 'Classical music']",Violin,False,False
23,where do the blackhawks play?,['United Center'],Chicago,False,False
24,when does the vietnam war end?,['1975-04-30'],"April 30, 1975.",False,True
25,what music did louis armstrong play?,"['Swing music', 'Jazz', 'Dixieland', 'Scat singing', 'Traditional pop music']","Jazz, blues.",False,False
26,who did cristiano ronaldo play for in 2010?,"['Portugal national football team', 'Real Madrid C.F.']",Portugal,False,True
27,where was martin luther king jr buried?,"['Martin Luther King, Jr. National Historic Site']",South View Cemetery,False,False
28,when did the libyan conflict start?,['2011-03-19'],2011,False,False
29,where did queensland get its name from?,['Queen Victoria'],"""Queen's land""",False,False
30,who does nolan ryan play for?,"['Houston Astros', 'California Angels']",New York Mets,False,False
31,where did the second battle of ypres occur?,['Ypres'],"Ypres, Belgium.",False,True
32,which country does greenland belong to?,['Denmark'],Denmark,True,True
33,what country did the battle of san juan hill take place?,['Santiago de Cuba'],Cuba,False,False
34,when was president wilson in office?,['1913-03-04'],"March 4, 1913 - March 4, 1921",False,False
35,what year did the bulls get rodman?,['1995'],1995,True,True
36,who did kurt warner play 4?,"['Amsterdam Admirals', 'Northern Iowa Panthers football', 'Iowa Barnstormers', 'New York Giants', 'St. Louis Rams', 'Arizona Cardinals']",Arizona Cardinals,True,True
37,who played carmen cortez in spy kids?,"['Alexa Vega', 'Addisyn Fair']",Daryl Sabara,False,False
38,what team did aguero play for?,"['Manchester City F.C.', 'Argentina national football team', 'Club Atlético Independiente', 'Atlético Madrid']",Manchester City,False,False
39,where does freddie ljungberg come from?,['Vittsjö'],Swedish,False,False
40,what year did jimmy the rev sullivan die?,['2009-12-28'],2009,False,False
41,what time zone is anaheim california?,['Pacific Time Zone'],Pacific Time Zone,True,True
42,what is claire danes famous for?,"['Actor', 'Television producer', 'Voice Actor']",film actor,False,False
43,who does albert pujols play for 2012?,"['Los Angeles Angels of Anaheim', 'Scottsdale Scorpions']",St. Louis Cardinals,False,False
44,where does sherrod brown live?,"['Avon', 'Mansfield']",Unknown,False,False
45,what baseball team was jackie robinson on?,"['Kansas City Monarchs', 'Montreal Royals', 'Brooklyn Dodgers']",Brooklyn Dodgers,True,True
46,where does fabio capello come from?,"[""San Canzian d'Isonzo""]",Italy,False,False
47,where did frank baum die?,['Hollywood'],Unknown,False,False
48,what kind of music did jimi hendrix play?,"['Blues', 'Acid rock', 'Blues rock', 'Heavy metal', 'Psychedelic rock', 'Rock music', 'Rhythm and blues', 'Experimental rock', 'Funk rock', 'Psychedelia', 'Progressive rock', 'Hard rock']",Psychedelic rock.,True,True
49,what was the cause of death for huell howser?,['Prostate cancer'],Unknown,False,False
50,what school does james franco go to?,"['Brooklyn College', 'Columbia University School of the Arts', 'Rhode Island School of Design', 'Warren Wilson College', 'Tisch School of the Arts', 'Palo Alto High School',...",educommunication,False,False
51,what were amelia earhart's achievements?,"['Writer', 'Pilot']",First female aviator to fly solo across the Atlantic.,False,False
52,who or what influenced albert einstein?,"['Henry George', 'Baruch Spinoza', 'Karl Pearson', 'Hermann Minkowski', 'Moritz Schlick', 'David Hume', 'Fyodor Dostoyevsky', 'George Bernard Shaw', 'Isaac Newton', 'James Clerk Maxwell', 'Mahatma Gandhi', 'Riazuddin',...","Moritz Schlick, Hermann Minkowski, Karl Pearson, Hendrik Lorentz, Henry George",False,True
53,what does lauren conrad major in?,['Fashion design'],Fashion Design,True,True
54,where did they find jenni rivera's body?,['Iturbide'],unknown,False,False
55,which ocean does the zambezi river flow into?,['Indian Ocean'],Indian Ocean,True,True
56,what is the name of sonia gandhi daughter?,['Priyanka Gandhi'],Unknown,False,False
57,what was f. scott fitzgerald?,"['Novelist', 'Poet', 'Writer']",American writer,False,False
58,what team did david beckham play for before la galaxy?,['Manchester United F.C.'],England national under-18 association football team,False,False
59,who is mary mcleod bethune for kids?,['Educator'],Teacher,False,True
60,what is jamie spears baby name?,['Maddie Briann Aldridge'],Jamie Lynn,False,False
61,what country did magellan represent?,['Kingdom of Portugal'],Portugal,False,True
62,what does kim kardashian work as?,"['Businessperson', 'Fashion designer', 'Actor', 'Television producer', 'Socialite', 'Entrepreneur', 'Model', 'TV Personality']",Reality TV star,False,True
63,who founded new york university?,"['Albert Gallatin', 'Mordecai Manuel Noah']",Albert Gallatin,True,True
64,when did we start war with iraq?,['2003-03-20'],2003,False,False
65,what town was martin luther king assassinated in?,['Memphis'],Memphis,True,True
66,what time zone am i in california?,['Pacific Time Zone'],Pacific Time Zone,True,True
67,who founded the kkk?,"['John C. Lester', 'John B. Kennedy', 'James R. Crowe', 'Frank O. McCord', 'Richard R. Reed', 'J. Calvin Jones']",Nathan Bedford Forrest,False,False
68,what was francis bacon contributions?,"['Spy', 'Statesman', 'Philosopher', 'Scientist', 'Author']","Scientific method, empiricism, Novum Organum",False,False
69,where did kennedy's inaugural address take place?,"['United States Capitol', 'Washington, D.C.']","Washington, D.C.",True,True
70,what school did ben roethlisberger go to?,['Miami University'],Miami University,True,True
71,when did william mckinley died?,['1901-09-14'],"September 14, 1901.",False,True
72,where was terry waite born?,['Bollington'],"Flint, United States.",False,False
73,where was st. lucy born?,['Syracuse'],Barbados,False,False
74,what made richard hammond famous?,"['Presenter', 'Stunt Performer', 'Television producer', 'Radio personality', 'Writer', 'Journalist', 'Screenwriter', 'Author', 'Voice Actor']",television presenter,False,True
75,where did nat turner 1831 rebellion occur?,['Southampton County'],"Southampton County, Virginia.",False,False
76,what team does colin kaepernick play for?,['San Francisco 49ers'],No team.,False,False
77,what year did super mario bros 2 come out?,['1988-10'],1988,False,False
78,where is augusta masters 2012?,['Augusta National Golf Course'],"Augusta, Georgia.",False,False
79,what city does paul ryan live in?,['Janesville'],Lystra,False,False
80,what did dr josef mengele do?,['Physician'],Nazi war criminal.,False,False
81,what timezone is elizabethtown kentucky?,['Eastern Time Zone'],Eastern Standard Time,False,True
82,who was the son of king leonidas?,['Pleistarchus'],Leonidas II,False,False
83,what school did martin luther king jr received his doctorate degree from?,['Boston University'],Boston University,True,True
84,where did benjamin franklin went to school?,['Boston Latin School'],Self-taught,False,False
85,what concentration camp did anne frank died in?,['Bergen-Belsen concentration camp'],Bergen-Belsen concentration camp.,True,True
86,who does ronaldinho play for now 2011?,"['Brazil national football team', 'Clube de Regatas do Flamengo']",AC Milan,False,False
87,where does sami yusuf live?,['Tehran'],Unknown.,False,False
88,who were mary shelley?,"['Editor', 'Biographer', 'Playwright', 'Travel writer', 'Novelist', 'Writer', 'Essayist', 'Author']",Author of Frankenstein.,False,True
89,what was robert burns?,"['Poet', 'Writer', 'Bard', 'Author']",songwriter of Scots songs,False,False
90,what county is brentwood tennessee in?,['Williamson County'],Davidson County,False,False
91,who did cliff lee play for last year?,['Philadelphia Phillies'],Philadelphia Phillies,True,True
92,where did morgan freeman graduate?,"['Los Angeles City College', 'Pasadena Playhouse']",High school dropout.,False,False
93,who influenced samuel taylor coleridge?,"['Giambattista Vico', 'Baruch Spinoza', 'Thomas Browne', 'Friedrich Wilhelm Joseph Schelling', 'Emanuel Swedenborg', 'Immanuel Kant', 'John Milton', 'William Shakespeare', 'Robert Burns', 'Algernon Charles Swinburne']","Anne Coleridge, George Coleridge, William Coleridge, James Coleridge, Edward Coleridge",False,False
94,what is the new movie john carter about?,"['Fantasy', 'Action Film', 'Adventure Film', 'Science Fiction']","Action, science fiction, adventure film.",False,True
95,what year does hitler die?,['1945-04-30'],1945,False,False
96,who created arthur?,"['WGBH', 'Marc Brown', 'Cookie Jar Group']",Arthur,False,True
97,what happened to pope john paul ii?,"[""Parkinson's disease"", 'heart attack']","April 2, 2005.",False,False
98,who was the leader of the first communist party of china?,"['Li Dazhao', 'Mao Zedong', 'Zhou Enlai', 'Chen Duxiu']",Xi Jinping,False,False
99,where did bristol palin go to school?,"['Juneau-Douglas High School', 'Wasilla High School', 'West Anchorage High School']",High school dropout,False,False
100,where all did picasso live?,"['Málaga', 'Madrid', 'France']","Málaga, Château of Vauvenarg",False,False
101,where did the battle of waterloo occur?,['Waterloo'],Belgium,False,False
102,where was huey newton killed?,['Oakland'],"Oakland, California.",False,False
103,who plays robin hood in prince of thieves?,['Kevin Costner'],Jon Hall,False,False
104,what did george clemenceau do?,"['Statesman', 'Publisher', 'Physician', 'Writer', 'Journalist']","French Prime Minister, WWI leader",False,False
105,where did theodor schwann study?,"['Humboldt University of Berlin', 'University of Würzburg', 'University of Bonn']","Bonn, Leuven, Berlin",False,True
106,who did brett gardner play for in 2008?,['New York Yankees'],New York Yankees,True,True
107,who was wesley snipes?,"['Businessperson', 'Film Producer', 'Dancer', 'Actor', 'Martial Artist', 'Singer']",actor,True,True
108,who does michael oher play for in 2010?,['Baltimore Ravens'],Tennessee Titans,False,False
109,where did hank marvin come from?,['Newcastle upon Tyne'],British,False,False
110,where was jesus after he died on the cross?,['Judea'],empty tomb,False,False
111,what position did vince lombardi play?,['Right guard'],Football coach,False,False
112,what did bobby darin die of?,['Surgical complications'],Heart failure.,False,False
113,what influenced william shakespeare to start writing?,"['Lucian', 'Christopher Marlowe', 'Edmund Spenser', 'Geoffrey Chaucer', 'John Pory', 'Plautus', 'Plutarch', 'Thomas More', 'Terence', 'Virgil', 'Ovid', 'Michel de Montaigne', 'Thomas Kyd', 'Seneca the Younger']","Plautus, Christopher Marlowe, Ovid, Seneca",False,False
114,what team is hank baskett on 2010?,"['Indianapolis Colts', 'Minnesota Vikings', 'Philadelphia Eagles']",Philadelphia Eagles,True,True
115,where does lil wayne go to school?,"['University of Phoenix', 'University of Houston', 'Lafayette Elementary School', 'Mcmain Magnet Secondary School', 'Eleanor McMain Secondary School']",Unknown.,False,False
116,what is jamie oliver children names?,"['Petal Blossom Rainbow Oliver', 'Daisy Boo Pamela Oliver', 'Poppy Honey Rosie Oliver', 'Buddy Bear Maurice Oliver']","Daisy, Poppy, Petal, Buddy, River",False,False
117,what nationality is taylor lautner jacob black?,['United States of America'],American,False,False
118,where did adolf hitler die?,['Berlin'],Study Room,False,False
119,what was antoni gaudi inspired by?,"['Eugène Viollet-le-Duc', 'William Morris']","Isidre Puig Boada, No specific books or articles, Reus",False,False
120,what time in hilo hawaii?,['Hawaii-Aleutian Time Zone'],12:00 AM,False,False
121,what nationality is mother teresa?,"['India', 'Ottoman Empire']",Albanian,False,False
122,where does chef ina garten live?,['Brooklyn'],Unknown,False,False
123,where did the russian japanese war happen?,"['Korean Peninsula', 'Manchuria', 'Yellow Sea']","Russia, Japan",False,False
124,where is the home stadium of the new england patriots?,['Gillette Stadium'],Gillette Stadium,True,True
125,where was teddy roosevelt's house?,"['New York City', 'Washington, D.C.']",Tacoma,False,False
126,what degrees does romney have?,"['Juris Doctor', 'Bachelor of Arts', 'MBA']",MBA,True,True
127,who plays king julian madagascar?,['Sacha Baron Cohen'],Sacha Baron Cohen,True,True
128,what did bernie mac died of?,"['Sarcoidosis', 'Complications from pneumonia']",Pneumonia.,False,False
129,what did randy savage died of?,['heart attack'],Heart attack,True,True
130,where did kim kardashian come from?,['Los Angeles'],Los Angeles,True,True
131,who played jacob black in twilight?,['Taylor Lautner'],Taylor Lautner,True,True
132,where is the time zone line in south dakota?,"['Central Time Zone', 'Mountain Time Zone']","Rapid City, Sioux Falls.",False,False
133,what year did the phillies begin?,['1883'],1883,True,True
134,who has pudge rodriguez played for?,"['Miami Marlins', 'Detroit Tigers', 'Texas Rangers']","Detroit Tigers, Texas Rangers",False,True
135,where did hugo chavez go to school?,"['Julian Pino School', ""Daniel Florencio O'Leary School"", 'Simón Bolívar University', 'Bolivarian Military University of Venezuela']",Military Academy,False,False
136,what country does alaska belong to?,['United States of America'],United States,False,False
137,what county is san antonio in?,['Comal County'],Bexar,False,False
138,what timezone is sweden gmt?,['Central European Time Zone'],GMT,False,False
139,where is chris rock from?,['Andrews'],South Carolina,False,False
140,where is south portland?,['Cumberland County'],Maine,False,False
141,who did jackie robinson first play for?,['UCLA Bruins football'],Brooklyn Dodgers,False,False
142,what type of cancer did eva peron die from?,"['Cervical cancer', 'Cancer']",Cervical uterine cancer.,False,True
143,where do john lennon die?,['New York City'],The Dakota.,False,False
144,what country did buddha come from?,['Nepal'],Nepal,True,True
145,what instrument does louis armstrong?,"['Cornet', 'Trumpet']",cornet,True,True
146,where is denmark south carolina?,['Bamberg County'],"33.3226° N, 81.1470° W",False,False
147,what position did lebron james play?,"['Power forward', 'Small forward', 'Point forward']",Small forward.,True,True
148,where does the city of paris get its name?,['Parisii'],"Greek, Celtic, Roman.",False,False
149,who is michael buble?,"['Actor', 'Singer', 'Songwriter']",Michael Bublé is a Canadian singer.,False,True
150,where is mitt romney's family from?,['Detroit'],United Kingdom,False,False
151,where does tim roth come from?,['Dulwich'],"Haverfordwest, Wales",False,False
152,when did roth ira originate?,"['William V. Roth, Jr.']",1997,False,False
153,what did romo do?,['Baseball player'],music genre,False,False
154,what awards did marilyn monroe won?,"['Golden Globe Award for Best Actress – Motion Picture – Musical or Comedy', 'Playboy Playmate', 'David di Donatello Golden Plate Award', 'Golden Globe Henrietta Award...",3,False,False
155,where does the celtics practice?,"['TD Garden', 'XL Center']",Boston.,False,False
156,what kind of hispanic is selena gomez?,"['Mexicans', 'Italian American']",Mexican-American.,False,False
157,what is the zip code for morgantown wv?,"['26505', '26501', '26508', '26507', '26506', '26504', '26502']",26505,True,True
158,what did st. nicholas do in his life?,['Bishop'],Unknown,False,False
159,what kind of cancer did carl wilson have?,"['Lung cancer', 'Brain tumor']",lung cancer,True,True
160,who played damien in the omen 2006?,"['Tomas Wooler', 'Seamus Davey-Fitzpatrick']",Harvey Spencer Stephens.,False,False
161,what nationality is rihanna?,['Barbados'],Barbadian,False,False
162,what degrees did barack obama get?,"['Juris Doctor', 'Bachelor of Arts']","JD, LLD, Bachelor of Arts",False,True
163,what did jack london do for a living?,"['Sailor', 'Novelist', 'Journalist', 'Screenwriter', 'Essayist', 'Author']","author, writing, journalism, lecturing",False,False
164,where is president kennedy buried?,['Arlington National Cemetery'],John F. Kennedy Eternal Flame.,False,True
165,where did thomas paine die?,['New York City'],New Rochelle.,False,False
166,where was the first gulf war fought?,"['Saudi Arabia', 'Israel', 'Kuwait', 'Persian Gulf', 'Arabian Peninsula', 'Iraq']","Kuwait, Arabian Peninsula, Iraq, Saudi Arabia.",False,True
167,where did rob kardashian go to school?,['USC Marshall School of Business'],USC,False,False
168,where did thomas hobbes live?,['Paris'],Malmesbury,False,False
169,what are the names of michael jackson's 3 children?,"['Paris-Michael Katherine Jackson', 'Michael Joseph Jackson, Jr.', 'Prince Michael Jackson II']","Prince, Paris, Blanket",False,True
170,what year did president william henry harrison take office?,['1841-03-04'],1841,False,False
171,who were king henry vii children?,"['Arthur, Prince of Wales', 'Edward Tudor', 'Henry VIII of England', 'Katherine Tudor', 'Elizabeth Tudor', 'Edmund Tudor, Duke of Somerset', 'Edward Tudor', 'Roland de Velville', 'Mary...","Henry VIII, Arthur, Margaret, Mary, Elizabeth.",False,True
172,where did sanjay gupta go to school?,"['Novi High School', 'University of Michigan', 'University of Michigan Health System']",University of Michigan,True,True
173,what time zone is pennsylvania in right now?,"['UTC−05:00', 'Eastern Time Zone']",Eastern Time Zone,True,True
174,what type of guitar does johnny depp play?,"['Guitar', 'Slide guitar']",Unknown,False,False
175,what is the zip code for jonesboro ar?,"['72401', '72404', '72403', '72402']",72401,True,True
176,who was tupac signed to?,"['Death Row Records', 'Interscope Records', 'Amaru Entertainment']",Interscope Records,True,True
177,what did galileo do to become famous?,"['Astrologer', 'Mathematician', 'Physicist', 'Scientist', 'Astronomer']",Observations and discoveries.,False,False
178,where does marta play soccer?,"[""Brazil women's national football team"", 'Tyresö FF']",Sahlen's Stadium.,False,False
179,where did kim jong il die?,['Pyongyang'],Kumsusan Palace of the Sun.,False,False
180,what is the stanley cup named after?,"['Frederick Stanley, 16th Earl of Derby']",donated the cup,False,False
181,what has angelina jolie accomplished?,"['Film Producer', 'Actor', 'Film director', 'Writer', 'Model', 'Screenwriter', 'Author', 'Voice Actor']","executive producer, Clinton Foundation, name change, Hollywood Film Awards, Angelina Jolie filmography, Many awards and recognition, Humanitarian work.",False,False
182,where was toussaint l'ouverture born?,['Saint-Domingue'],Saint-Marc,False,False
183,where did romney graduated college?,['Brigham Young University'],Brigham Young University.,True,True
184,what did george orwell died of?,['Tuberculosis'],tuberculosis,True,True
185,where did spencer pratt go to school?,['University of Southern California'],unknown,False,False
186,what is the zip code for walnut creek?,"['94596', '94598', '94597', '94595']",94595,True,True
187,what style of music does michael jackson perform?,"['New jack swing', 'Contemporary R&B', 'Disco', 'Motown Sound', 'Electronic music', 'Dance-pop', 'Adult contemporary music', 'Funk', 'Post-disco', 'Pop rock', 'Pop music', 'Rock music', 'Rhythm and blues',...","rhythm and blues, hip hop, soul, rock, dance",False,True
188,where was elvis costello born?,['Paddington'],London,False,False
189,where was country singer george jones born?,['Saratoga'],"Saratoga, Texas",False,False
190,what religion does madonna practice?,"['Jewish Renewal', 'Catholicism']",Catholic,False,False
191,what is the zip code for princeton nj?,"['08542', '08540', '08543', '08544', '08541', '08542-4511', '08540-6449']",08540,True,True
192,what did coretta scott king died from?,['Respiratory failure'],Natural causes.,False,False
193,where george lopez was born?,['Mission Hills'],Los Angeles,False,False
194,who influenced picasso art?,"['Eugène Delacroix', 'Édouard Manet', 'Henri Rousseau', 'Francisco Goya', 'Sara Murphy', 'Paul Cézanne', 'Vincent van Gogh', 'Jean-Auguste-Dominique Ingres', 'Henri de Toulouse-Lautrec', 'Paul Gauguin', 'Diego Velázquez', 'Alfred...",Pierre-Narcisse Guérin,False,False
195,what kind of leukemia did jill clayburgh have?,"['B-cell chronic lymphocytic leukemia', 'Leukemia']",Unknown,False,False
196,where did giuliana rancic grow up?,['Naples'],Sicily.,False,False
197,who or what influenced frank lloyd wright?,"['Ebenezer Howard', 'Georges I. Gurdjieff and Thomas De Hartmann', 'Bruce Price', 'William Morris', 'Henry David Thoreau', 'Elizabeth Gordon', 'Louis Sullivan']","Louis Sullivan, Richard Morris Hunt, Henry Hobson Richardson",False,False
198,what club does cristiano ronaldo play for in 2010?,"['Portugal national football team', 'Real Madrid C.F.']",Real Madrid,False,True
199,what influenced john steinbeck to start writing?,"['Sherwood Anderson', 'Thomas Malory', 'William Faulkner', 'Robert Burns']","Salinas, California.",False,False
200,where did anne frank go to school?,"['Montessori Lyceum Amsterdam', 'Jewish Lyceum']",homeschooled,False,False
201,where did eleanor roosevelt die?,['Manhattan'],Upper East Side,False,False
202,who is richard pryor son?,"['Franklin Pryor', 'Richard Pryor Jr.', 'Steven Pryor']",No results.,False,False
203,what degrees did obama get in college?,"['Juris Doctor', 'Bachelor of Arts']","Bachelor of Arts, Juris Doctor",False,True
204,what was laura ingalls wilder famous for?,"['Teacher', 'Writer', 'Journalist', 'Author']",autobiographer,False,False
205,who owns chrysler corporation 2011?,"['Fiat Chrysler Automobiles', 'Federal government of the United States', 'Government of Canada', 'Voluntary Employee Beneficiary Association', 'Fiat S.p.A.']",Exor,False,False
206,what was dr seuss education?,"['Dartmouth College', 'University of Oxford', 'Lincoln College, Oxford']",Dartmouth College.,True,True
207,what school did mark zuckerberg attend?,"['Phillips Exeter Academy', 'Mercy College', 'Harvard University', 'Ardsley High School']",Harvard University,True,True
208,who is rick scott?,"['Businessperson', 'Investor', 'Executive officer', 'Lawyer', 'Politician']",David,False,False
209,what did jesus do for living?,"['Carpentry', 'Prophet', 'Preacher']",carpenter,False,True
210,where did alex chilton die?,['New Orleans'],Memphis,False,False
211,where is kansas city?,['Platte County'],Kansas City is in Missouri.,False,False
212,what team did ronaldo play for in 2003?,"['Brazil national football team', 'Real Madrid C.F.']",Manchester United,False,False
213,what county is st paul nc in?,['Robeson County'],Wilson,False,False
214,what inspired steinbeck?,"['Sherwood Anderson', 'Thomas Malory', 'William Faulkner', 'Robert Burns']","Ernest Hemingway, William Faulkner, Edith Wharton.",False,False
215,where do the seattle seahawks play?,['CenturyLink Field'],Lumen Field.,False,True
216,who did nasri play for before arsenal?,['Olympique de Marseille'],Marseille,False,True
217,where was john jay born?,['New York City'],370 Jay Street,False,False
218,what is the zip code for azle texas?,"['76020', '76098']",76020,True,True
219,what did f. scott fitzgerald do?,"['Novelist', 'Poet', 'Writer']",writer,True,True
220,what does helen flanagan do?,['Actor'],"television actor, model",False,False
221,what team is raul ibanez on?,['Kansas City Royals'],New York Cosmos,False,False
222,what country did gregor mendel live in?,"['Austrian Silesia', 'Brno']",Czech Republic,False,False
223,who plays anakin skywalker in star wars 1?,['Jake Lloyd'],Hayden Christensen,False,False
224,where did mitt romney's parents come from?,['Detroit'],Mexico,False,False
225,what year was hitler was born?,['1889-04-20'],"April 20, 1889",False,True
