,question,example_answer,pred_answer,exact_matching,lm_evaluation
226,where was mary todd lincoln from?,['Lexington'],Kentucky,False,False
227,what the zip code for seattle washington?,"['98109', '98131', '98122', '98166', '98168', '98198', '98155', '98188', '98105', '98112', '98103', '98104', '98115', '98101', '98102', '98116', '98108', '98121', '98144', '98107', '98125', '98117', '98133', '98134', '98199',...",98101,True,True
228,who formed the american federation of labor?,['Samuel Gompers'],Samuel Gompers.,True,True
229,what is the nigeria time?,['West Africa Time Zone'],UTC+01:00,False,False
230,what kind of writing is nikolai gogol famous for?,"['Playwright', 'Novelist', 'Writer']",Literature.,False,False
231,what is my timezone in louisiana?,['Central Time Zone'],It depends.,False,False
232,what time in china hong kong?,['Hong Kong Time Zone'],UTC+08:00,False,True
233,where president obama was born?,['Honolulu'],Los Angeles,False,False
234,who wrote the gospel according to john?,['John the Evangelist'],John,False,False
235,where is tyrese gibson from?,['Watts'],Los Angeles.,False,False
236,where was rihanna raised?,['Saint Michael Parish'],Barbados,False,False
237,who played bilbo in the fellowship of the ring?,['Ian Holm'],Ian Holm,True,True
238,what school did miley cyrus?,['Heritage Elementary School'],JMC Academy,False,False
239,where did charles darwin die?,['Down House'],Bedroom,False,False
240,where was marilyn monroe found dead?,['Brentwood'],12305 Fifth Helena Drive,False,False
241,what timezone is sweden?,['Central European Time Zone'],CET,False,True
242,what's my timezone in oklahoma?,['Central Time Zone'],Central Time Zone,True,True
243,what school did sir ernest rutherford go to?,"['Nelson College', 'University of New Zealand', 'University of Cambridge', 'Trinity College, Cambridge', 'University of Canterbury']",University of Canterbury,True,True
244,what was the cause of death for bruce lee?,['Cerebral edema'],cerebral edema,True,True
245,what was scottie pippen known for?,"['Basketball player', 'Actor']","Basketball player, NBA champion, Olympic gold medalist, Hall of Famer",False,True
246,where did richard arkwright grow up?,"['Preston, Lancashire']",Preston,False,True
247,what the time zone in japan?,['Japan Time Zone'],Japan Standard Time,False,True
248,who does peyton manning play football for?,['Denver Broncos'],Denver Broncos,True,True
249,what teams has manny ramirez played for?,"['Boston Red Sox', 'Chicago White Sox', 'Cleveland Indians', 'Chicago Cubs', 'Los Angeles Dodgers', 'Oakland Athletics', 'Tampa Bay Rays', 'Texas Rangers', 'EDA Rhinos']",Tampa Bay Rays,True,True
250,where did harry s truman go to school?,"['University of Missouri–Kansas City', 'University of Missouri–Kansas City School of Law', 'William Chrisman High School']",William Chrisman High School,True,True
251,where was caesar when he was stabbed?,['Theatre of Pompey'],Theatre of Pompey,True,True
252,what did stephen hawking become famous for?,"['Professor', 'Astrophysicist', 'Science writer', 'Cosmologist', 'Mathematician', 'Physicist', 'Scientist', 'Writer', 'Astronomer', 'Author']","Physicist, Author, Cosmologist",False,True
253,where are the timezones in the usa?,"['Samoa Time Zone', 'Chamorro Time Zone', 'Central Time Zone', 'Eastern Time Zone', 'Mountain Time Zone', 'Pacific Time Zone', 'Alaska Time Zone', 'Hawaii-Aleutian Time Zone', 'Atlantic...","UTC−11:00, UTC−12:00, UTC+10:00, UTC+12:00, UTC−08:00",False,False
254,what was thomas jefferson role in the declaration of independence?,"['Statesman', 'Teacher', 'Philosopher', 'Archaeologist', 'Inventor', 'Lawyer', 'Writer', 'Farmer', 'Author', 'Architect']",principal author,False,False
255,where is bob marley buried?,['Bob Marley Mausoleum'],"Nine Mile, Jamaica",False,True
256,where did tim tebow grow up?,['Makati'],"Jacksonville, Florida",False,False
257,what is lawton ok zip code?,"['73505', '73507', '73501', '73506', '73502']",73501,True,True
258,what music period did beethoven live in?,"['Opera', 'Classical music']",Classical,False,True
259,who is angelina jolie?,"['Film Producer', 'Actor', 'Film director', 'Writer', 'Model', 'Screenwriter', 'Author', 'Voice Actor']",American actress.,False,False
260,what is san francisco zip code?,"['94119', '94108', '94133', '94103', '94107', '94114', '94104', '94118', '94102', '94122', '94110', '94123', '94124', '94115', '94101', '94121', '94117', '94111', '94131', '94112', '94105', '94146', '94132', '94127', '94128',...",94102,True,True
261,where did george w bush live as a child?,['New Haven'],"Midland, Texas.",False,False
262,where was barack hussein obama sr born?,"[""Nyang'oma Kogelo""]",Kenya,False,False
263,where was shakespeare born at?,['Stratford-upon-Avon'],Stratford-upon-Avon.,True,True
264,where did francisco coronado come from?,['Salamanca'],Spain,False,True
265,what is houston timezone?,['Central Time Zone'],Central Standard Time,False,True
266,what was gregor mendel contribution?,"['Monk', 'Botanist', 'Scientist']",Father of genetics.,False,False
267,what was lucille ball?,"['Comedian', 'Actor', 'Television producer', 'Singer', 'Model']",comedian,True,True
268,who did terrell owens play for in 2010?,"['Buffalo Bills', 'Cincinnati Bengals', 'Texas Revolution']",Buffalo Bills,True,True
269,what did shannon hoon die from?,['Drug overdose'],Drug interactions.,False,False
270,who plays stephanie plum in one for the money?,['Katherine Heigl'],Katherine Heigl,True,True
271,what team did messi play for in 2010?,"['Argentina national football team', 'FC Barcelona']",Barcelona,False,True
272,what is london uk time zone?,['Greenwich Mean Time Zone'],UTC±00:00,False,True
273,where did the mississippi river end?,['Gulf of Mexico'],Gulf of Mexico,True,True
274,when did the battle of alamo start?,['1836-02-23'],"March 6, 1836",False,False
275,where did john franklin live?,['Blue Island'],Unknown,False,False
276,what timezone is phoenix az in right now?,['Mountain Time Zone'],Mountain Time Zone,True,True
277,where do florida panthers play?,"['BB&T Center', 'Miami Arena']",Amerant Bank Arena in Miami.,False,False
278,who does kroy biermann play football for?,['Atlanta Falcons'],Free agent,False,False
279,what kind of music did franz liszt compose?,"['Opera', 'Romantic music', 'Art song', 'Classical music', 'Chamber music']","classical, Hungarian folk, romantic, symphony",False,False
280,where laura ingalls wilder lived?,"['De Smet', 'Pepin', 'Kansas', 'Burr Oak', 'Walnut Grove', 'Mansfield']",Mansfield,True,True
281,what inspired michael jackson to become a singer?,"['Redd Foxx', 'Charlie Chaplin', 'James Brown', 'Nipsey Russell', 'Walt Disney']","James Brown, Jackie Wilson, Fred Astaire",False,False
282,where does michelle pfeiffer live now?,['Orange County'],Unknown,False,False
283,who was king henry viii son?,"['Edward VI of England', 'Henry FitzRoy, 1st Duke of Richmond and Somerset', 'Henry, Duke of Cornwall']",Edward Tudor,False,False
284,what football team is michael vick on?,['New York Jets'],Michael Vick is retired.,False,False
285,what country did toussaint l'ouverture help free?,"['French Army', 'Haitian Rebellion of 1891', 'French Revolutionary Army']",Haiti,False,False
286,what did steve mcnair died from?,['Ballistic trauma'],ballistic trauma,True,True
287,where was john f kennedy when he got shot?,['Dallas'],Hickory Hill.,False,False
288,what religion did adolf hitler follow?,"['Christianity', 'Catholicism']",Atheist,False,False
289,what is the current time in bangalore india?,['India Time Zone'],Indian Standard Time,False,True
290,where was the vietnam war location?,"['Vietnam', 'Cambodia', 'Laos', 'Southeast Asia', 'South Vietnam', 'North Vietnam']","Cambodia, Laos, North Vietnam, Republic of Vietnam.",False,True
291,what team does josh hamilton play for?,['Los Angeles Angels of Anaheim'],Cincinnati Reds,False,False
292,what time zone is in the bahamas?,"['UTC−05:00', 'Eastern Time Zone']",Eastern Standard Time,False,True
293,where is jay leno from?,['New Rochelle'],United States,False,False
294,what team does jeremy lin play for 2013?,['Houston Rockets'],Charlotte Hornets,False,False
295,where are the texas rangers playing?,['Rangers Ballpark in Arlington'],Unknown,False,False
296,what did st augustine do?,"['Philosopher', 'Physician', 'Writer']","Confessions, saint, August 28",False,False
297,where did antoine lavoisier die?,['Place de la Concorde'],place de la Concorde,True,True
298,what school did robert f kennedy go to?,"['Harvard College', 'Bates College', 'Milton Academy', 'Harvard University', 'University of Virginia School of Law', 'University of Virginia']",Canterbury School,False,False
299,where was theodore roosevelt buried?,['Youngs Memorial Cemetery'],"Oyster Bay, New York.",False,False
